21:01:09.532057 IP ec2-34-212-190-229.us-west-2.compute.amazonaws.com.https > lasagna-pc.58636: Flags [P.], seq 3854353:3854384, ack 1483246621, win 65535, length 31
21:01:09.532109 IP lasagna-pc.58636 > ec2-34-212-190-229.us-west-2.compute.amazonaws.com.https: Flags [.], ack 31, win 65320, length 0
21:01:09.532518 IP lasagna-pc.58636 > ec2-34-212-190-229.us-west-2.compute.amazonaws.com.https: Flags [P.], seq 1:32, ack 31, win 65320, length 31
21:01:09.532518 IP ec2-34-212-190-229.us-west-2.compute.amazonaws.com.https > lasagna-pc.58636: Flags [F.], seq 31, ack 1, win 65535, length 0
21:01:09.532568 IP lasagna-pc.58636 > ec2-34-212-190-229.us-west-2.compute.amazonaws.com.https: Flags [F.], seq 32, ack 32, win 65320, length 0
21:01:09.532784 IP ec2-34-212-190-229.us-west-2.compute.amazonaws.com.https > lasagna-pc.58636: Flags [F.], seq 31, ack 32, win 65535, length 0
21:01:09.532803 IP lasagna-pc.58636 > ec2-34-212-190-229.us-west-2.compute.amazonaws.com.https: Flags [.], ack 32, win 65320, length 0
21:01:09.532835 IP ec2-34-212-190-229.us-west-2.compute.amazonaws.com.https > lasagna-pc.58636: Flags [.], ack 33, win 65535, length 0
21:01:09.637662 IP lasagna-pc.54750 > 66.61.168.195.http: Flags [.], ack 1856869, win 30345, length 0
21:01:09.637759 IP lasagna-pc.54748 > 66.61.168.195.http: Flags [.], ack 1792869, win 30345, length 0
21:01:09.638118 IP 66.61.168.195.http > lasagna-pc.54750: Flags [.], ack 1, win 65535, length 0
21:01:09.638132 IP 66.61.168.195.http > lasagna-pc.54748: Flags [.], ack 1, win 65535, length 0
21:01:10.405918 IP lasagna-pc.60710 > dc01.eecs.net.domain: 10154+ [1au] PTR? 15.2.0.10.in-addr.arpa. (51)
21:01:10.436556 IP dc01.eecs.net.domain > lasagna-pc.60710: 10154 NXDomain 0/0/1 (51)
21:01:10.437494 IP lasagna-pc.60710 > dc01.eecs.net.domain: 10154+ PTR? 15.2.0.10.in-addr.arpa. (40)
21:01:10.460615 IP dc01.eecs.net.domain > lasagna-pc.60710: 10154 NXDomain 0/0/0 (40)
21:01:10.461643 IP lasagna-pc.60173 > dc01.eecs.net.domain: 41689+ [1au] PTR? 229.190.212.34.in-addr.arpa. (56)
21:01:10.575342 IP dc01.eecs.net.domain > lasagna-pc.60173: 41689 1/0/1 PTR ec2-34-212-190-229.us-west-2.compute.amazonaws.com. (120)
21:01:10.576112 IP lasagna-pc.40684 > dc01.eecs.net.domain: 47132+ [1au] PTR? 195.168.61.66.in-addr.arpa. (55)
21:01:10.620711 IP dc01.eecs.net.domain > lasagna-pc.40684: 47132 NXDomain 0/1/1 (111)
21:01:10.620926 IP lasagna-pc.40684 > dc01.eecs.net.domain: 47132+ PTR? 195.168.61.66.in-addr.arpa. (44)
21:01:10.643900 IP dc01.eecs.net.domain > lasagna-pc.40684: 47132 NXDomain 0/1/0 (100)
21:01:11.423182 IP lasagna-pc.52601 > dc01.eecs.net.domain: 62963+ [1au] PTR? 201.89.19.10.in-addr.arpa. (54)
21:01:11.447464 IP dc01.eecs.net.domain > lasagna-pc.52601: 62963* 1/0/1 PTR dc01.eecs.net. (81)
21:01:13.213570 IP lasagna-pc.36880 > a23-43-59-202.deploy.static.akamaitechnologies.com.http: Flags [.], ack 64770, win 31088, length 0
21:01:13.214046 IP a23-43-59-202.deploy.static.akamaitechnologies.com.http > lasagna-pc.36880: Flags [.], ack 1, win 65535, length 0
21:01:13.470074 IP lasagna-pc.34884 > dc01.eecs.net.domain: 48699+ [1au] PTR? 202.59.43.23.in-addr.arpa. (54)
21:01:13.525716 IP dc01.eecs.net.domain > lasagna-pc.34884: 48699 1/0/1 PTR a23-43-59-202.deploy.static.akamaitechnologies.com. (118)
21:01:16.334466 IP lasagna-pc.37266 > 229.26.211.130.bc.googleusercontent.com.https: Flags [P.], seq 2686895054:2686895100, ack 1990168, win 49700, length 46
21:01:16.335126 IP 229.26.211.130.bc.googleusercontent.com.https > lasagna-pc.37266: Flags [.], ack 46, win 65535, length 0
21:01:16.362706 IP 229.26.211.130.bc.googleusercontent.com.https > lasagna-pc.37266: Flags [P.], seq 1:47, ack 46, win 65535, length 46
21:01:16.406619 IP lasagna-pc.37266 > 229.26.211.130.bc.googleusercontent.com.https: Flags [.], ack 47, win 49700, length 0
21:01:16.550166 IP lasagna-pc.48182 > 72.21.91.29.http: Flags [.], ack 1220730, win 38612, length 0
21:01:16.550283 IP lasagna-pc.48212 > 72.21.91.29.http: Flags [.], ack 4352790, win 30732, length 0
21:01:16.550294 IP lasagna-pc.46928 > ec2-35-162-118-79.us-west-2.compute.amazonaws.com.https: Flags [.], ack 4227921, win 39760, length 0
21:01:16.550296 IP lasagna-pc.46932 > ec2-35-162-118-79.us-west-2.compute.amazonaws.com.https: Flags [.], ack 4163921, win 38340, length 0
21:01:16.550345 IP lasagna-pc.46930 > ec2-35-162-118-79.us-west-2.compute.amazonaws.com.https: Flags [.], ack 4099921, win 38340, length 0
21:01:16.550374 IP lasagna-pc.38232 > lga34s14-in-f3.1e100.net.http: Flags [.], ack 896715, win 29946, length 0
21:01:16.550403 IP lasagna-pc.38228 > lga34s14-in-f3.1e100.net.http: Flags [.], ack 832715, win 29946, length 0
21:01:16.550431 IP lasagna-pc.38230 > lga34s14-in-f3.1e100.net.http: Flags [.], ack 768715, win 29946, length 0
21:01:16.550603 IP 72.21.91.29.http > lasagna-pc.48182: Flags [.], ack 1, win 65535, length 0
21:01:16.550653 IP 72.21.91.29.http > lasagna-pc.48212: Flags [.], ack 1, win 65535, length 0
21:01:16.550659 IP ec2-35-162-118-79.us-west-2.compute.amazonaws.com.https > lasagna-pc.46928: Flags [.], ack 1, win 65535, length 0
21:01:16.550665 IP ec2-35-162-118-79.us-west-2.compute.amazonaws.com.https > lasagna-pc.46932: Flags [.], ack 1, win 65535, length 0
21:01:16.550671 IP ec2-35-162-118-79.us-west-2.compute.amazonaws.com.https > lasagna-pc.46930: Flags [.], ack 1, win 65535, length 0
21:01:16.550677 IP lga34s14-in-f3.1e100.net.http > lasagna-pc.38232: Flags [.], ack 1, win 65535, length 0
21:01:16.550699 IP lga34s14-in-f3.1e100.net.http > lasagna-pc.38228: Flags [.], ack 1, win 65535, length 0
21:01:16.550706 IP lga34s14-in-f3.1e100.net.http > lasagna-pc.38230: Flags [.], ack 1, win 65535, length 0
21:01:16.551020 IP lasagna-pc.43839 > dc01.eecs.net.domain: 62809+ [1au] PTR? 229.26.211.130.in-addr.arpa. (56)
21:01:16.656190 IP dc01.eecs.net.domain > lasagna-pc.43839: 62809 1/0/1 PTR 229.26.211.130.bc.googleusercontent.com. (109)
21:01:16.657051 IP lasagna-pc.38819 > dc01.eecs.net.domain: 7197+ [1au] PTR? 29.91.21.72.in-addr.arpa. (53)
21:01:16.688058 IP dc01.eecs.net.domain > lasagna-pc.38819: 7197 NXDomain 0/1/1 (124)
21:01:16.688457 IP lasagna-pc.38819 > dc01.eecs.net.domain: 7197+ PTR? 29.91.21.72.in-addr.arpa. (42)
21:01:16.711622 IP dc01.eecs.net.domain > lasagna-pc.38819: 7197 NXDomain 0/1/0 (113)
21:01:17.566103 IP lasagna-pc.45009 > dc01.eecs.net.domain: 13714+ [1au] PTR? 79.118.162.35.in-addr.arpa. (55)
21:01:17.609748 IP dc01.eecs.net.domain > lasagna-pc.45009: 13714 1/0/1 PTR ec2-35-162-118-79.us-west-2.compute.amazonaws.com. (118)
21:01:17.611220 IP lasagna-pc.54094 > dc01.eecs.net.domain: 63897+ [1au] PTR? 67.10.217.172.in-addr.arpa. (55)
21:01:17.657299 IP dc01.eecs.net.domain > lasagna-pc.54094: 63897 1/0/1 PTR lga34s14-in-f3.1e100.net. (93)
21:01:19.875148 IP lasagna-pc.54750 > 66.61.168.195.http: Flags [.], ack 1, win 30345, length 0
21:01:19.875209 IP lasagna-pc.54748 > 66.61.168.195.http: Flags [.], ack 1, win 30345, length 0
21:01:19.875613 IP 66.61.168.195.http > lasagna-pc.54750: Flags [.], ack 1, win 65535, length 0
21:01:19.875628 IP 66.61.168.195.http > lasagna-pc.54748: Flags [.], ack 1, win 65535, length 0
21:01:23.454721 IP lasagna-pc.36880 > a23-43-59-202.deploy.static.akamaitechnologies.com.http: Flags [.], ack 1, win 31088, length 0
21:01:23.455301 IP a23-43-59-202.deploy.static.akamaitechnologies.com.http > lasagna-pc.36880: Flags [.], ack 1, win 65535, length 0
21:01:26.782686 IP lasagna-pc.46928 > ec2-35-162-118-79.us-west-2.compute.amazonaws.com.https: Flags [.], ack 1, win 39760, length 0
21:01:26.782869 IP lasagna-pc.48182 > 72.21.91.29.http: Flags [.], ack 1, win 38612, length 0
21:01:26.782873 IP lasagna-pc.38232 > lga34s14-in-f3.1e100.net.http: Flags [.], ack 1, win 29946, length 0
21:01:26.782875 IP lasagna-pc.38228 > lga34s14-in-f3.1e100.net.http: Flags [.], ack 1, win 29946, length 0
21:01:26.782878 IP lasagna-pc.38230 > lga34s14-in-f3.1e100.net.http: Flags [.], ack 1, win 29946, length 0
21:01:26.782880 IP lasagna-pc.48212 > 72.21.91.29.http: Flags [.], ack 1, win 30732, length 0
21:01:26.782949 IP lasagna-pc.46932 > ec2-35-162-118-79.us-west-2.compute.amazonaws.com.https: Flags [.], ack 1, win 38340, length 0
21:01:26.782999 IP lasagna-pc.46930 > ec2-35-162-118-79.us-west-2.compute.amazonaws.com.https: Flags [.], ack 1, win 38340, length 0
21:01:26.783186 IP ec2-35-162-118-79.us-west-2.compute.amazonaws.com.https > lasagna-pc.46928: Flags [.], ack 1, win 65535, length 0
21:01:26.783201 IP 72.21.91.29.http > lasagna-pc.48182: Flags [.], ack 1, win 65535, length 0
21:01:26.783207 IP lga34s14-in-f3.1e100.net.http > lasagna-pc.38232: Flags [.], ack 1, win 65535, length 0
21:01:26.783213 IP lga34s14-in-f3.1e100.net.http > lasagna-pc.38228: Flags [.], ack 1, win 65535, length 0
21:01:26.783218 IP lga34s14-in-f3.1e100.net.http > lasagna-pc.38230: Flags [.], ack 1, win 65535, length 0
21:01:26.783224 IP 72.21.91.29.http > lasagna-pc.48212: Flags [.], ack 1, win 65535, length 0
21:01:26.783230 IP ec2-35-162-118-79.us-west-2.compute.amazonaws.com.https > lasagna-pc.46932: Flags [.], ack 1, win 65535, length 0
21:01:26.783236 IP ec2-35-162-118-79.us-west-2.compute.amazonaws.com.https > lasagna-pc.46930: Flags [.], ack 1, win 65535, length 0
21:01:28.973844 IP6 lasagna-pc.mdns > ff02::fb.mdns: 0 [2q] PTR (QM)? _ipps._tcp.local. PTR (QM)? _ipp._tcp.local. (45)
21:01:29.023333 IP lasagna-pc.55452 > dc01.eecs.net.domain: 30400+ [1au] PTR? b.f.0.0.0.0.0.0.0.0.0.0.0.0.0.0.0.0.0.0.0.0.0.0.0.0.0.0.2.0.f.f.ip6.arpa. (101)
21:01:29.128652 IP dc01.eecs.net.domain > lasagna-pc.55452: 30400 NXDomain 0/1/1 (165)
21:01:29.129037 IP lasagna-pc.55452 > dc01.eecs.net.domain: 30400+ PTR? b.f.0.0.0.0.0.0.0.0.0.0.0.0.0.0.0.0.0.0.0.0.0.0.0.0.0.0.2.0.f.f.ip6.arpa. (90)
21:01:29.152552 IP dc01.eecs.net.domain > lasagna-pc.55452: 30400 NXDomain 0/1/0 (154)
21:01:29.153845 IP lasagna-pc.40846 > dc01.eecs.net.domain: 14362+ [1au] PTR? 6.6.5.2.d.9.b.3.c.f.4.5.f.4.3.a.0.0.0.0.0.0.0.0.0.0.0.0.0.8.e.f.ip6.arpa. (101)
21:01:29.198872 IP dc01.eecs.net.domain > lasagna-pc.40846: 14362 NXDomain 0/1/1 (165)
21:01:29.199306 IP lasagna-pc.40846 > dc01.eecs.net.domain: 14362+ PTR? 6.6.5.2.d.9.b.3.c.f.4.5.f.4.3.a.0.0.0.0.0.0.0.0.0.0.0.0.0.8.e.f.ip6.arpa. (90)
21:01:29.222472 IP dc01.eecs.net.domain > lasagna-pc.40846: 14362 NXDomain 0/1/0 (154)
21:01:29.516889 IP lasagna-pc.mdns > 224.0.0.251.mdns: 0 [2q] PTR (QM)? _ipps._tcp.local. PTR (QM)? _ipp._tcp.local. (45)
21:01:30.049856 IP lasagna-pc.54933 > dc01.eecs.net.domain: 48358+ [1au] PTR? 251.0.0.224.in-addr.arpa. (53)
21:01:30.083889 IP dc01.eecs.net.domain > lasagna-pc.54933: 48358 NXDomain 0/1/1 (110)
21:01:30.084222 IP lasagna-pc.54933 > dc01.eecs.net.domain: 48358+ PTR? 251.0.0.224.in-addr.arpa. (42)
21:01:30.108307 IP dc01.eecs.net.domain > lasagna-pc.54933: 48358 NXDomain 0/1/0 (99)
21:01:30.109624 IP lasagna-pc.54750 > 66.61.168.195.http: Flags [.], ack 1, win 30345, length 0
21:01:30.109708 IP lasagna-pc.54748 > 66.61.168.195.http: Flags [.], ack 1, win 30345, length 0
21:01:30.110014 IP 66.61.168.195.http > lasagna-pc.54750: Flags [.], ack 1, win 65535, length 0
21:01:30.110027 IP 66.61.168.195.http > lasagna-pc.54748: Flags [.], ack 1, win 65535, length 0
21:01:30.512069 IP lasagna-pc.35625 > dc01.eecs.net.domain: 29899+ [1au] A? introtopython.org. (46)
21:01:30.512370 IP lasagna-pc.50991 > dc01.eecs.net.domain: 40405+ [1au] AAAA? introtopython.org. (46)
21:01:30.634256 IP dc01.eecs.net.domain > lasagna-pc.50991: 40405 0/1/1 (121)
21:01:30.765118 IP dc01.eecs.net.domain > lasagna-pc.35625: 29899 1/0/1 A 208.94.116.22 (62)
21:01:30.766025 IP lasagna-pc.52534 > ip-208-94-116-22.sites.nearlyfreespeech.net.http: Flags [SEW], seq 3409841717, win 29200, options [mss 1460,sackOK,TS val 2708605396 ecr 0,nop,wscale 7], length 0
21:01:30.865074 IP ip-208-94-116-22.sites.nearlyfreespeech.net.http > lasagna-pc.52534: Flags [S.], seq 14208001, ack 3409841718, win 65535, options [mss 1460], length 0
21:01:30.865178 IP lasagna-pc.52534 > ip-208-94-116-22.sites.nearlyfreespeech.net.http: Flags [.], ack 1, win 29200, length 0
21:01:31.070074 IP lasagna-pc.47119 > dc01.eecs.net.domain: 64393+ [1au] PTR? 22.116.94.208.in-addr.arpa. (55)
21:01:31.094724 IP dc01.eecs.net.domain > lasagna-pc.47119: 64393 1/0/1 PTR ip-208-94-116-22.sites.nearlyfreespeech.net. (112)
21:01:31.399369 IP lasagna-pc.54596 > s3-console-us-standard.console.aws.amazon.com.http: Flags [SEW], seq 3766870887, win 29200, options [mss 1460,sackOK,TS val 3156805533 ecr 0,nop,wscale 7], length 0
21:01:31.399744 IP lasagna-pc.48782 > dc01.eecs.net.domain: 11191+ [1au] A? amazon.com. (39)
21:01:31.399924 IP lasagna-pc.38555 > dc01.eecs.net.domain: 44826+ [1au] AAAA? amazon.com. (39)
21:01:31.430661 IP dc01.eecs.net.domain > lasagna-pc.48782: 11191 3/0/1 A 176.32.103.205, A 176.32.98.166, A 205.251.242.103 (87)
21:01:31.434394 IP s3-console-us-standard.console.aws.amazon.com.http > lasagna-pc.54596: Flags [S.], seq 14336001, ack 3766870888, win 65535, options [mss 1460], length 0
21:01:31.434480 IP lasagna-pc.54596 > s3-console-us-standard.console.aws.amazon.com.http: Flags [.], ack 1, win 29200, length 0
21:01:31.443064 IP lasagna-pc.33850 > dc01.eecs.net.domain: 8370+ [1au] A? tiles.services.mozilla.com. (55)
21:01:31.443313 IP lasagna-pc.46584 > dc01.eecs.net.domain: 28269+ [1au] AAAA? tiles.services.mozilla.com. (55)
21:01:31.445098 IP dc01.eecs.net.domain > lasagna-pc.38555: 44826 0/1/1 (100)
21:01:31.445180 IP lasagna-pc.37854 > ec2-52-43-40-243.us-west-2.compute.amazonaws.com.https: Flags [SEW], seq 3969820900, win 29200, options [mss 1460,sackOK,TS val 3935825361 ecr 0,nop,wscale 7], length 0
21:01:31.473675 IP dc01.eecs.net.domain > lasagna-pc.33850: 8370 9/0/1 CNAME tiles.r53-2.services.mozilla.com., A 35.164.197.9, A 52.26.103.165, A 52.25.148.139, A 35.164.130.113, A 35.160.41.125, A 52.39.131.77, A 52.35.250.5, A 35.165.22.140 (209)
21:01:31.549004 IP dc01.eecs.net.domain > lasagna-pc.46584: 28269 1/1/1 CNAME tiles.r53-2.services.mozilla.com. (163)
21:01:31.568863 IP ec2-52-43-40-243.us-west-2.compute.amazonaws.com.https > lasagna-pc.37854: Flags [S.], seq 14400001, ack 3969820901, win 65535, options [mss 1460], length 0
21:01:31.568944 IP lasagna-pc.37854 > ec2-52-43-40-243.us-west-2.compute.amazonaws.com.https: Flags [.], ack 1, win 29200, length 0
21:01:31.570929 IP lasagna-pc.37854 > ec2-52-43-40-243.us-west-2.compute.amazonaws.com.https: Flags [P.], seq 1:518, ack 1, win 29200, length 517
21:01:31.571676 IP ec2-52-43-40-243.us-west-2.compute.amazonaws.com.https > lasagna-pc.37854: Flags [.], ack 518, win 65535, length 0
21:01:31.628545 IP lasagna-pc.58768 > dc01.eecs.net.domain: 12583+ [1au] A? safebrowsing.googleapis.com. (56)
21:01:31.628769 IP lasagna-pc.52766 > dc01.eecs.net.domain: 40225+ [1au] AAAA? safebrowsing.googleapis.com. (56)
21:01:31.653778 IP dc01.eecs.net.domain > lasagna-pc.58768: 12583 1/0/1 A 172.217.3.106 (72)
21:01:31.677706 IP dc01.eecs.net.domain > lasagna-pc.52766: 40225 1/0/1 AAAA 2607:f8b0:4006:802::200a (84)
21:01:31.678531 IP lasagna-pc.59412 > sea09s17-in-f10.1e100.net.https: Flags [SEW], seq 225391020, win 29200, options [mss 1460,sackOK,TS val 740359418 ecr 0,nop,wscale 7], length 0
21:01:31.699078 IP ec2-52-43-40-243.us-west-2.compute.amazonaws.com.https > lasagna-pc.37854: Flags [.], seq 1:2841, ack 518, win 65535, length 2840
21:01:31.699250 IP lasagna-pc.37854 > ec2-52-43-40-243.us-west-2.compute.amazonaws.com.https: Flags [.], ack 2841, win 34080, length 0
21:01:31.701371 IP ec2-52-43-40-243.us-west-2.compute.amazonaws.com.https > lasagna-pc.37854: Flags [P.], seq 2841:3015, ack 518, win 65535, length 174
21:01:31.702261 IP lasagna-pc.37854 > ec2-52-43-40-243.us-west-2.compute.amazonaws.com.https: Flags [.], ack 3015, win 36920, length 0
21:01:31.706745 IP sea09s17-in-f10.1e100.net.https > lasagna-pc.59412: Flags [S.], seq 14464001, ack 225391021, win 65535, options [mss 1460], length 0
21:01:31.706796 IP lasagna-pc.59412 > sea09s17-in-f10.1e100.net.https: Flags [.], ack 1, win 29200, length 0
21:01:31.711380 IP lasagna-pc.37854 > ec2-52-43-40-243.us-west-2.compute.amazonaws.com.https: Flags [P.], seq 518:644, ack 3015, win 36920, length 126
21:01:31.715123 IP ec2-52-43-40-243.us-west-2.compute.amazonaws.com.https > lasagna-pc.37854: Flags [.], ack 644, win 65535, length 0
21:01:31.718630 IP lasagna-pc.59412 > sea09s17-in-f10.1e100.net.https: Flags [P.], seq 1:518, ack 1, win 29200, length 517
21:01:31.719502 IP sea09s17-in-f10.1e100.net.https > lasagna-pc.59412: Flags [.], ack 518, win 65535, length 0
21:01:31.723965 IP lasagna-pc.37854 > ec2-52-43-40-243.us-west-2.compute.amazonaws.com.https: Flags [P.], seq 644:1489, ack 3015, win 36920, length 845
21:01:31.725591 IP ec2-52-43-40-243.us-west-2.compute.amazonaws.com.https > lasagna-pc.37854: Flags [.], ack 1489, win 65535, length 0
21:01:31.761852 IP sea09s17-in-f10.1e100.net.https > lasagna-pc.59412: Flags [P.], seq 1:1367, ack 518, win 65535, length 1366
21:01:31.761891 IP lasagna-pc.59412 > sea09s17-in-f10.1e100.net.https: Flags [.], ack 1367, win 31418, length 0
21:01:31.762406 IP sea09s17-in-f10.1e100.net.https > lasagna-pc.59412: Flags [P.], seq 1367:2733, ack 518, win 65535, length 1366
21:01:31.762425 IP lasagna-pc.59412 > sea09s17-in-f10.1e100.net.https: Flags [.], ack 2733, win 34150, length 0
21:01:31.765097 IP sea09s17-in-f10.1e100.net.https > lasagna-pc.59412: Flags [P.], seq 2733:3674, ack 518, win 65535, length 941
21:01:31.765142 IP lasagna-pc.59412 > sea09s17-in-f10.1e100.net.https: Flags [.], ack 3674, win 36882, length 0
21:01:31.795206 IP lasagna-pc.51787 > dc01.eecs.net.domain: 41152+ [1au] A? ocsp.pki.goog. (42)
21:01:31.795407 IP lasagna-pc.46511 > dc01.eecs.net.domain: 25455+ [1au] AAAA? ocsp.pki.goog. (42)
21:01:31.819501 IP dc01.eecs.net.domain > lasagna-pc.51787: 41152 2/0/1 CNAME pki-goog.l.google.com., A 172.217.10.35 (93)
21:01:31.845554 IP ec2-52-43-40-243.us-west-2.compute.amazonaws.com.https > lasagna-pc.37854: Flags [P.], seq 3015:3066, ack 1489, win 65535, length 51
21:01:31.845598 IP dc01.eecs.net.domain > lasagna-pc.46511: 25455 2/0/1 CNAME pki-goog.l.google.com., AAAA 2607:f8b0:4006:81b::2003 (105)
21:01:31.851403 IP ec2-52-43-40-243.us-west-2.compute.amazonaws.com.https > lasagna-pc.37854: Flags [P.], seq 3066:3321, ack 1489, win 65535, length 255
21:01:31.852039 IP lasagna-pc.37854 > ec2-52-43-40-243.us-west-2.compute.amazonaws.com.https: Flags [.], ack 3321, win 39760, length 0
21:01:31.852433 IP lasagna-pc.42972 > lga34s13-in-f3.1e100.net.http: Flags [SEW], seq 966325154, win 29200, options [mss 1460,sackOK,TS val 677040291 ecr 0,nop,wscale 7], length 0
21:01:31.882208 IP lga34s13-in-f3.1e100.net.http > lasagna-pc.42972: Flags [S.], seq 14528001, ack 966325155, win 65535, options [mss 1460], length 0
21:01:31.882292 IP lasagna-pc.42972 > lga34s13-in-f3.1e100.net.http: Flags [.], ack 1, win 29200, length 0
21:01:31.882585 IP lasagna-pc.42972 > lga34s13-in-f3.1e100.net.http: Flags [P.], seq 1:392, ack 1, win 29200, length 391: HTTP: POST /GTSGIAG3 HTTP/1.1
21:01:31.883009 IP lga34s13-in-f3.1e100.net.http > lasagna-pc.42972: Flags [.], ack 392, win 65535, length 0
21:01:31.929390 IP lga34s13-in-f3.1e100.net.http > lasagna-pc.42972: Flags [P.], seq 1:714, ack 392, win 65535, length 713: HTTP: HTTP/1.1 200 OK
21:01:31.929436 IP lasagna-pc.42972 > lga34s13-in-f3.1e100.net.http: Flags [.], ack 714, win 29946, length 0
21:01:31.932758 IP lasagna-pc.59412 > sea09s17-in-f10.1e100.net.https: Flags [P.], seq 518:582, ack 3674, win 36882, length 64
21:01:31.934341 IP lasagna-pc.59412 > sea09s17-in-f10.1e100.net.https: Flags [P.], seq 582:752, ack 3674, win 36882, length 170
21:01:31.934349 IP sea09s17-in-f10.1e100.net.https > lasagna-pc.59412: Flags [.], ack 582, win 65535, length 0
21:01:31.934394 IP lasagna-pc.59412 > sea09s17-in-f10.1e100.net.https: Flags [P.], seq 752:1182, ack 3674, win 36882, length 430
21:01:31.934901 IP sea09s17-in-f10.1e100.net.https > lasagna-pc.59412: Flags [.], ack 752, win 65535, length 0
21:01:31.934917 IP sea09s17-in-f10.1e100.net.https > lasagna-pc.59412: Flags [.], ack 1182, win 65535, length 0
21:01:31.962911 IP sea09s17-in-f10.1e100.net.https > lasagna-pc.59412: Flags [P.], seq 3674:4176, ack 1182, win 65535, length 502
21:01:31.962961 IP lasagna-pc.59412 > sea09s17-in-f10.1e100.net.https: Flags [.], ack 4176, win 39614, length 0
21:01:31.966056 IP sea09s17-in-f10.1e100.net.https > lasagna-pc.59412: Flags [P.], seq 4176:4269, ack 1182, win 65535, length 93
21:01:31.966118 IP lasagna-pc.59412 > sea09s17-in-f10.1e100.net.https: Flags [.], ack 4269, win 39614, length 0
21:01:31.967160 IP lasagna-pc.59412 > sea09s17-in-f10.1e100.net.https: Flags [P.], seq 1182:1213, ack 4269, win 39614, length 31
21:01:31.968009 IP sea09s17-in-f10.1e100.net.https > lasagna-pc.59412: Flags [.], ack 1213, win 65535, length 0
21:01:31.985322 IP sea09s17-in-f10.1e100.net.https > lasagna-pc.59412: Flags [P.], seq 4269:5056, ack 1213, win 65535, length 787
21:01:31.996101 IP sea09s17-in-f10.1e100.net.https > lasagna-pc.59412: Flags [P.], seq 5056:5095, ack 1213, win 65535, length 39
21:01:31.996395 IP lasagna-pc.59412 > sea09s17-in-f10.1e100.net.https: Flags [.], ack 5095, win 42346, length 0
21:01:31.996803 IP lasagna-pc.59412 > sea09s17-in-f10.1e100.net.https: Flags [P.], seq 1213:1252, ack 5095, win 42346, length 39
21:01:31.997646 IP sea09s17-in-f10.1e100.net.https > lasagna-pc.59412: Flags [.], ack 1252, win 65535, length 0
21:01:32.078174 IP lasagna-pc.42498 > s3-console-us-standard.console.aws.amazon.com.https: Flags [SEW], seq 656787851, win 29200, options [mss 1460,sackOK,TS val 3156806211 ecr 0,nop,wscale 7], length 0
21:01:32.098016 IP lasagna-pc.59023 > dc01.eecs.net.domain: 32423+ [1au] PTR? 103.242.251.205.in-addr.arpa. (57)
21:01:32.120240 IP s3-console-us-standard.console.aws.amazon.com.https > lasagna-pc.42498: Flags [S.], seq 14656001, ack 656787852, win 65535, options [mss 1460], length 0
21:01:32.120310 IP lasagna-pc.42498 > s3-console-us-standard.console.aws.amazon.com.https: Flags [.], ack 1, win 29200, length 0
21:01:32.121549 IP lasagna-pc.42498 > s3-console-us-standard.console.aws.amazon.com.https: Flags [P.], seq 1:518, ack 1, win 29200, length 517
21:01:32.122553 IP s3-console-us-standard.console.aws.amazon.com.https > lasagna-pc.42498: Flags [.], ack 518, win 65535, length 0
21:01:32.137398 IP lasagna-pc.57857 > dc01.eecs.net.domain: 52702+ [1au] A? www.amazon.com. (43)
21:01:32.137695 IP lasagna-pc.45880 > dc01.eecs.net.domain: 63626+ [1au] AAAA? www.amazon.com. (43)
21:01:32.143251 IP dc01.eecs.net.domain > lasagna-pc.59023: 32423 1/0/1 PTR s3-console-us-standard.console.aws.amazon.com. (116)
21:01:32.144923 IP lasagna-pc.58292 > dc01.eecs.net.domain: 6880+ [1au] PTR? 243.40.43.52.in-addr.arpa. (54)
21:01:32.161354 IP s3-console-us-standard.console.aws.amazon.com.https > lasagna-pc.42498: Flags [P.], seq 1:1361, ack 518, win 65535, length 1360
21:01:32.161392 IP lasagna-pc.42498 > s3-console-us-standard.console.aws.amazon.com.https: Flags [.], ack 1361, win 31280, length 0
21:01:32.161554 IP s3-console-us-standard.console.aws.amazon.com.https > lasagna-pc.42498: Flags [.], seq 1361:2781, ack 518, win 65535, length 1420
21:01:32.161572 IP lasagna-pc.42498 > s3-console-us-standard.console.aws.amazon.com.https: Flags [.], ack 2781, win 34080, length 0
21:01:32.161755 IP s3-console-us-standard.console.aws.amazon.com.https > lasagna-pc.42498: Flags [P.], seq 2781:5471, ack 518, win 65535, length 2690
21:01:32.161768 IP lasagna-pc.42498 > s3-console-us-standard.console.aws.amazon.com.https: Flags [.], ack 5471, win 39760, length 0
21:01:32.165587 IP lasagna-pc.42498 > s3-console-us-standard.console.aws.amazon.com.https: Flags [P.], seq 518:644, ack 5471, win 39760, length 126
21:01:32.166214 IP s3-console-us-standard.console.aws.amazon.com.https > lasagna-pc.42498: Flags [.], ack 644, win 65535, length 0
21:01:32.167810 IP dc01.eecs.net.domain > lasagna-pc.57857: 52702 3/0/1 CNAME www.cdn.amazon.com., CNAME d3ag4hukkh62yn.cloudfront.net., A 99.84.109.115 (124)
21:01:32.175749 IP dc01.eecs.net.domain > lasagna-pc.45880: 63626 2/0/1 CNAME www.cdn.amazon.com., CNAME d3ag4hukkh62yn.cloudfront.net. (108)
21:01:32.176144 IP lasagna-pc.58378 > dc01.eecs.net.domain: 31981+ [1au] AAAA? d3ag4hukkh62yn.cloudfront.net. (58)
21:01:32.188714 IP dc01.eecs.net.domain > lasagna-pc.58292: 6880 1/0/1 PTR ec2-52-43-40-243.us-west-2.compute.amazonaws.com. (116)
21:01:32.190163 IP lasagna-pc.40304 > dc01.eecs.net.domain: 1676+ [1au] PTR? 106.3.217.172.in-addr.arpa. (55)
21:01:32.199275 IP dc01.eecs.net.domain > lasagna-pc.58378: 31981 0/1/1 (139)
21:01:32.199924 IP lasagna-pc.56652 > server-99-84-109-115.iad79.r.cloudfront.net.https: Flags [SEW], seq 4185343280, win 29200, options [mss 1460,sackOK,TS val 1614181970 ecr 0,nop,wscale 7], length 0
21:01:32.201514 IP s3-console-us-standard.console.aws.amazon.com.https > lasagna-pc.42498: Flags [P.], seq 5471:5522, ack 644, win 65535, length 51
21:01:32.234678 IP dc01.eecs.net.domain > lasagna-pc.40304: 1676 2/0/1 PTR sea09s17-in-f10.1e100.net., PTR lga34s18-in-f10.1e100.net. (124)
21:01:32.235269 IP server-99-84-109-115.iad79.r.cloudfront.net.https > lasagna-pc.56652: Flags [S.], seq 14720001, ack 4185343281, win 65535, options [mss 1460], length 0
21:01:32.235335 IP lasagna-pc.56652 > server-99-84-109-115.iad79.r.cloudfront.net.https: Flags [.], ack 1, win 29200, length 0
21:01:32.235828 IP lasagna-pc.56914 > dc01.eecs.net.domain: 31003+ [1au] PTR? 35.10.217.172.in-addr.arpa. (55)
21:01:32.236639 IP lasagna-pc.56652 > server-99-84-109-115.iad79.r.cloudfront.net.https: Flags [P.], seq 1:518, ack 1, win 29200, length 517
21:01:32.237529 IP server-99-84-109-115.iad79.r.cloudfront.net.https > lasagna-pc.56652: Flags [.], ack 518, win 65535, length 0
21:01:32.245552 IP lasagna-pc.42498 > s3-console-us-standard.console.aws.amazon.com.https: Flags [.], ack 5522, win 39760, length 0
21:01:32.260169 IP dc01.eecs.net.domain > lasagna-pc.56914: 31003 1/0/1 PTR lga34s13-in-f3.1e100.net. (93)
21:01:32.273572 IP server-99-84-109-115.iad79.r.cloudfront.net.https > lasagna-pc.56652: Flags [P.], seq 1:2733, ack 518, win 65535, length 2732
21:01:32.273607 IP lasagna-pc.56652 > server-99-84-109-115.iad79.r.cloudfront.net.https: Flags [.], ack 2733, win 34080, length 0
21:01:32.274152 IP server-99-84-109-115.iad79.r.cloudfront.net.https > lasagna-pc.56652: Flags [P.], seq 2733:5280, ack 518, win 65535, length 2547
21:01:32.274172 IP lasagna-pc.56652 > server-99-84-109-115.iad79.r.cloudfront.net.https: Flags [.], ack 5280, win 38340, length 0
21:01:32.277237 IP lasagna-pc.56652 > server-99-84-109-115.iad79.r.cloudfront.net.https: Flags [P.], seq 518:644, ack 5280, win 38340, length 126
21:01:32.278596 IP server-99-84-109-115.iad79.r.cloudfront.net.https > lasagna-pc.56652: Flags [.], ack 644, win 65535, length 0
21:01:32.281328 IP lasagna-pc.56652 > server-99-84-109-115.iad79.r.cloudfront.net.https: Flags [P.], seq 644:821, ack 5280, win 38340, length 177
21:01:32.281459 IP lasagna-pc.56652 > server-99-84-109-115.iad79.r.cloudfront.net.https: Flags [P.], seq 821:1508, ack 5280, win 38340, length 687
21:01:32.282063 IP server-99-84-109-115.iad79.r.cloudfront.net.https > lasagna-pc.56652: Flags [.], ack 821, win 65535, length 0
21:01:32.282083 IP server-99-84-109-115.iad79.r.cloudfront.net.https > lasagna-pc.56652: Flags [.], ack 1508, win 65535, length 0
21:01:32.316779 IP server-99-84-109-115.iad79.r.cloudfront.net.https > lasagna-pc.56652: Flags [P.], seq 5280:5591, ack 1508, win 65535, length 311
21:01:32.316826 IP server-99-84-109-115.iad79.r.cloudfront.net.https > lasagna-pc.56652: Flags [P.], seq 5591:5629, ack 1508, win 65535, length 38
21:01:32.317543 IP lasagna-pc.56652 > server-99-84-109-115.iad79.r.cloudfront.net.https: Flags [P.], seq 1508:1546, ack 5629, win 41180, length 38
21:01:32.318968 IP server-99-84-109-115.iad79.r.cloudfront.net.https > lasagna-pc.56652: Flags [.], ack 1546, win 65535, length 0
21:01:32.404823 IP server-99-84-109-115.iad79.r.cloudfront.net.https > lasagna-pc.56652: Flags [P.], seq 5629:6393, ack 1546, win 65535, length 764
21:01:32.405214 IP server-99-84-109-115.iad79.r.cloudfront.net.https > lasagna-pc.56652: Flags [P.], seq 6393:6617, ack 1546, win 65535, length 224
21:01:32.405270 IP lasagna-pc.56652 > server-99-84-109-115.iad79.r.cloudfront.net.https: Flags [.], ack 6617, win 46860, length 0
21:01:32.406259 IP server-99-84-109-115.iad79.r.cloudfront.net.https > lasagna-pc.56652: Flags [P.], seq 6617:11240, ack 1546, win 65535, length 4623
21:01:32.406298 IP lasagna-pc.56652 > server-99-84-109-115.iad79.r.cloudfront.net.https: Flags [.], ack 11240, win 56800, length 0
21:01:32.407367 IP server-99-84-109-115.iad79.r.cloudfront.net.https > lasagna-pc.56652: Flags [P.], seq 11240:11300, ack 1546, win 65535, length 60
21:01:32.412222 IP server-99-84-109-115.iad79.r.cloudfront.net.https > lasagna-pc.56652: Flags [P.], seq 11300:12666, ack 1546, win 65535, length 1366
21:01:32.412255 IP lasagna-pc.56652 > server-99-84-109-115.iad79.r.cloudfront.net.https: Flags [.], ack 12666, win 59640, length 0
21:01:32.412326 IP server-99-84-109-115.iad79.r.cloudfront.net.https > lasagna-pc.56652: Flags [P.], seq 12666:16370, ack 1546, win 65535, length 3704
21:01:32.412341 IP lasagna-pc.56652 > server-99-84-109-115.iad79.r.cloudfront.net.https: Flags [.], ack 16370, win 65320, length 0
21:01:32.414314 IP server-99-84-109-115.iad79.r.cloudfront.net.https > lasagna-pc.56652: Flags [P.], seq 16370:16432, ack 1546, win 65535, length 62
21:01:32.414592 IP server-99-84-109-115.iad79.r.cloudfront.net.https > lasagna-pc.56652: Flags [P.], seq 16432:18377, ack 1546, win 65535, length 1945
21:01:32.414631 IP lasagna-pc.56652 > server-99-84-109-115.iad79.r.cloudfront.net.https: Flags [.], ack 18377, win 65320, length 0
21:01:32.415932 IP server-99-84-109-115.iad79.r.cloudfront.net.https > lasagna-pc.56652: Flags [P.], seq 18377:18777, ack 1546, win 65535, length 400
21:01:32.416485 IP server-99-84-109-115.iad79.r.cloudfront.net.https > lasagna-pc.56652: Flags [P.], seq 18777:21501, ack 1546, win 65535, length 2724
21:01:32.416504 IP lasagna-pc.56652 > server-99-84-109-115.iad79.r.cloudfront.net.https: Flags [.], ack 21501, win 65320, length 0
21:01:32.440157 IP server-99-84-109-115.iad79.r.cloudfront.net.https > lasagna-pc.56652: Flags [P.], seq 21501:22739, ack 1546, win 65535, length 1238
21:01:32.462455 IP lasagna-pc.37854 > ec2-52-43-40-243.us-west-2.compute.amazonaws.com.https: Flags [P.], seq 1489:2622, ack 3321, win 39760, length 1133
21:01:32.463554 IP ec2-52-43-40-243.us-west-2.compute.amazonaws.com.https > lasagna-pc.37854: Flags [.], ack 2622, win 65535, length 0
21:01:32.463990 IP server-99-84-109-115.iad79.r.cloudfront.net.https > lasagna-pc.56652: Flags [P.], seq 22739:24116, ack 1546, win 65535, length 1377
21:01:32.464019 IP lasagna-pc.56652 > server-99-84-109-115.iad79.r.cloudfront.net.https: Flags [.], ack 24116, win 65320, length 0
21:01:32.465149 IP server-99-84-109-115.iad79.r.cloudfront.net.https > lasagna-pc.56652: Flags [P.], seq 24116:27525, ack 1546, win 65535, length 3409
21:01:32.465211 IP lasagna-pc.56652 > server-99-84-109-115.iad79.r.cloudfront.net.https: Flags [.], ack 27525, win 65320, length 0
21:01:32.466217 IP server-99-84-109-115.iad79.r.cloudfront.net.https > lasagna-pc.56652: Flags [P.], seq 27525:28314, ack 1546, win 65535, length 789
21:01:32.496252 IP server-99-84-109-115.iad79.r.cloudfront.net.https > lasagna-pc.56652: Flags [P.], seq 28314:28366, ack 1546, win 65535, length 52
21:01:32.496411 IP lasagna-pc.56652 > server-99-84-109-115.iad79.r.cloudfront.net.https: Flags [.], ack 28366, win 65320, length 0
21:01:32.498437 IP server-99-84-109-115.iad79.r.cloudfront.net.https > lasagna-pc.56652: Flags [P.], seq 28366:29732, ack 1546, win 65535, length 1366
21:01:32.499733 IP server-99-84-109-115.iad79.r.cloudfront.net.https > lasagna-pc.56652: Flags [P.], seq 29732:33830, ack 1546, win 65535, length 4098
21:01:32.499765 IP lasagna-pc.56652 > server-99-84-109-115.iad79.r.cloudfront.net.https: Flags [.], ack 33830, win 65320, length 0
21:01:32.499826 IP server-99-84-109-115.iad79.r.cloudfront.net.https > lasagna-pc.56652: Flags [P.], seq 33830:36562, ack 1546, win 65535, length 2732
21:01:32.499839 IP lasagna-pc.56652 > server-99-84-109-115.iad79.r.cloudfront.net.https: Flags [.], ack 36562, win 65320, length 0
21:01:32.500166 IP server-99-84-109-115.iad79.r.cloudfront.net.https > lasagna-pc.56652: Flags [P.], seq 36562:39294, ack 1546, win 65535, length 2732
21:01:32.500186 IP lasagna-pc.56652 > server-99-84-109-115.iad79.r.cloudfront.net.https: Flags [.], ack 39294, win 65320, length 0
21:01:32.501626 IP server-99-84-109-115.iad79.r.cloudfront.net.https > lasagna-pc.56652: Flags [P.], seq 39294:40660, ack 1546, win 65535, length 1366
21:01:32.502138 IP server-99-84-109-115.iad79.r.cloudfront.net.https > lasagna-pc.56652: Flags [P.], seq 40660:43909, ack 1546, win 65535, length 3249
21:01:32.502158 IP lasagna-pc.56652 > server-99-84-109-115.iad79.r.cloudfront.net.https: Flags [.], ack 43909, win 65320, length 0
21:01:32.535601 IP server-99-84-109-115.iad79.r.cloudfront.net.https > lasagna-pc.56652: Flags [P.], seq 43909:48007, ack 1546, win 65535, length 4098
21:01:32.535634 IP lasagna-pc.56652 > server-99-84-109-115.iad79.r.cloudfront.net.https: Flags [.], ack 48007, win 65320, length 0
21:01:32.536109 IP server-99-84-109-115.iad79.r.cloudfront.net.https > lasagna-pc.56652: Flags [P.], seq 48007:56203, ack 1546, win 65535, length 8196
21:01:32.536132 IP lasagna-pc.56652 > server-99-84-109-115.iad79.r.cloudfront.net.https: Flags [.], ack 56203, win 65320, length 0
21:01:32.536788 IP server-99-84-109-115.iad79.r.cloudfront.net.https > lasagna-pc.56652: Flags [P.], seq 56203:57569, ack 1546, win 65535, length 1366
21:01:32.537132 IP server-99-84-109-115.iad79.r.cloudfront.net.https > lasagna-pc.56652: Flags [P.], seq 57569:59655, ack 1546, win 65535, length 2086
21:01:32.537154 IP lasagna-pc.56652 > server-99-84-109-115.iad79.r.cloudfront.net.https: Flags [.], ack 59655, win 65320, length 0
21:01:32.589286 IP ec2-52-43-40-243.us-west-2.compute.amazonaws.com.https > lasagna-pc.37854: Flags [P.], seq 3321:3576, ack 2622, win 65535, length 255
21:01:32.596121 IP lasagna-pc.56972 > dc01.eecs.net.domain: 17487+ [1au] A? images-na.ssl-images-amazon.com. (60)
21:01:32.596347 IP lasagna-pc.56708 > dc01.eecs.net.domain: 44565+ [1au] AAAA? images-na.ssl-images-amazon.com. (60)
21:01:32.629584 IP lasagna-pc.37854 > ec2-52-43-40-243.us-west-2.compute.amazonaws.com.https: Flags [.], ack 3576, win 42600, length 0
21:01:32.657133 IP dc01.eecs.net.domain > lasagna-pc.56708: 44565 2/0/1 CNAME m.media-amazon.com., CNAME c.media-amazon.com. (105)
21:01:32.657213 IP dc01.eecs.net.domain > lasagna-pc.56972: 17487 3/0/1 CNAME m.media-amazon.com., CNAME c.media-amazon.com., A 52.85.100.123 (121)
21:01:32.658312 IP lasagna-pc.47894 > dc01.eecs.net.domain: 17853+ [1au] AAAA? c.media-amazon.com. (47)
21:01:32.681732 IP dc01.eecs.net.domain > lasagna-pc.47894: 17853 0/1/1 (128)
21:01:32.693567 IP server-99-84-109-115.iad79.r.cloudfront.net.https > lasagna-pc.56652: Flags [P.], seq 59655:61021, ack 1546, win 65535, length 1366
21:01:32.693945 IP server-99-84-109-115.iad79.r.cloudfront.net.https > lasagna-pc.56652: Flags [P.], seq 61021:62741, ack 1546, win 65535, length 1720
21:01:32.693965 IP lasagna-pc.56652 > server-99-84-109-115.iad79.r.cloudfront.net.https: Flags [.], ack 62741, win 65320, length 0
21:01:32.695608 IP server-99-84-109-115.iad79.r.cloudfront.net.https > lasagna-pc.56652: Flags [P.], seq 62741:64107, ack 1546, win 65535, length 1366
21:01:32.695775 IP server-99-84-109-115.iad79.r.cloudfront.net.https > lasagna-pc.56652: Flags [P.], seq 64107:65473, ack 1546, win 65535, length 1366
21:01:32.695792 IP lasagna-pc.56652 > server-99-84-109-115.iad79.r.cloudfront.net.https: Flags [.], ack 65473, win 65320, length 0
21:01:32.697940 IP server-99-84-109-115.iad79.r.cloudfront.net.https > lasagna-pc.56652: Flags [P.], seq 65473:66839, ack 1546, win 65535, length 1366
21:01:32.698821 IP server-99-84-109-115.iad79.r.cloudfront.net.https > lasagna-pc.56652: Flags [P.], seq 66839:72303, ack 1546, win 65535, length 5464
21:01:32.698862 IP lasagna-pc.56652 > server-99-84-109-115.iad79.r.cloudfront.net.https: Flags [.], ack 72303, win 65320, length 0
21:01:32.705269 IP server-99-84-109-115.iad79.r.cloudfront.net.https > lasagna-pc.56652: Flags [P.], seq 72303:73077, ack 1546, win 65535, length 774
21:01:32.745553 IP lasagna-pc.56652 > server-99-84-109-115.iad79.r.cloudfront.net.https: Flags [.], ack 73077, win 65320, length 0
21:01:32.824935 IP server-99-84-109-115.iad79.r.cloudfront.net.https > lasagna-pc.56652: Flags [P.], seq 73077:74004, ack 1546, win 65535, length 927
21:01:32.825278 IP lasagna-pc.56652 > server-99-84-109-115.iad79.r.cloudfront.net.https: Flags [.], ack 74004, win 65320, length 0
21:01:32.825380 IP server-99-84-109-115.iad79.r.cloudfront.net.https > lasagna-pc.56652: Flags [P.], seq 74004:79303, ack 1546, win 65535, length 5299
21:01:32.825397 IP lasagna-pc.56652 > server-99-84-109-115.iad79.r.cloudfront.net.https: Flags [.], ack 79303, win 65320, length 0
21:01:32.825872 IP server-99-84-109-115.iad79.r.cloudfront.net.https > lasagna-pc.56652: Flags [P.], seq 79303:80669, ack 1546, win 65535, length 1366
21:01:32.825998 IP lasagna-pc.56652 > server-99-84-109-115.iad79.r.cloudfront.net.https: Flags [.], ack 80669, win 65320, length 0
21:01:32.829554 IP server-99-84-109-115.iad79.r.cloudfront.net.https > lasagna-pc.56652: Flags [P.], seq 80669:89702, ack 1546, win 65535, length 9033
21:01:32.829606 IP lasagna-pc.56652 > server-99-84-109-115.iad79.r.cloudfront.net.https: Flags [.], ack 89702, win 65320, length 0
21:01:32.829768 IP server-99-84-109-115.iad79.r.cloudfront.net.https > lasagna-pc.56652: Flags [P.], seq 89702:92434, ack 1546, win 65535, length 2732
21:01:32.829783 IP lasagna-pc.56652 > server-99-84-109-115.iad79.r.cloudfront.net.https: Flags [.], ack 92434, win 65320, length 0
21:01:32.831998 IP server-99-84-109-115.iad79.r.cloudfront.net.https > lasagna-pc.56652: Flags [P.], seq 92434:93800, ack 1546, win 65535, length 1366
21:01:32.832319 IP lasagna-pc.56652 > server-99-84-109-115.iad79.r.cloudfront.net.https: Flags [.], ack 93800, win 65320, length 0
21:01:32.832523 IP server-99-84-109-115.iad79.r.cloudfront.net.https > lasagna-pc.56652: Flags [P.], seq 93800:96895, ack 1546, win 65535, length 3095
21:01:32.832540 IP lasagna-pc.56652 > server-99-84-109-115.iad79.r.cloudfront.net.https: Flags [.], ack 96895, win 65320, length 0
21:01:32.835444 IP server-99-84-109-115.iad79.r.cloudfront.net.https > lasagna-pc.56652: Flags [P.], seq 96895:97091, ack 1546, win 65535, length 196
21:01:32.835571 IP server-99-84-109-115.iad79.r.cloudfront.net.https > lasagna-pc.56652: Flags [P.], seq 97091:102461, ack 1546, win 65535, length 5370
21:01:32.835609 IP lasagna-pc.56652 > server-99-84-109-115.iad79.r.cloudfront.net.https: Flags [.], ack 102461, win 65320, length 0
21:01:32.837556 IP server-99-84-109-115.iad79.r.cloudfront.net.https > lasagna-pc.56652: Flags [P.], seq 102461:103827, ack 1546, win 65535, length 1366
21:01:32.837733 IP lasagna-pc.56652 > server-99-84-109-115.iad79.r.cloudfront.net.https: Flags [.], ack 103827, win 65320, length 0
21:01:32.837991 IP server-99-84-109-115.iad79.r.cloudfront.net.https > lasagna-pc.56652: Flags [P.], seq 103827:107925, ack 1546, win 65535, length 4098
21:01:32.838007 IP lasagna-pc.56652 > server-99-84-109-115.iad79.r.cloudfront.net.https: Flags [.], ack 107925, win 65320, length 0
21:01:32.840451 IP server-99-84-109-115.iad79.r.cloudfront.net.https > lasagna-pc.56652: Flags [P.], seq 107925:109291, ack 1546, win 65535, length 1366
21:01:32.840496 IP server-99-84-109-115.iad79.r.cloudfront.net.https > lasagna-pc.56652: Flags [P.], seq 109291:115236, ack 1546, win 65535, length 5945
